{
  "schema": 1,
  "id": "repair-no-nonreplayable-external-side-effect",
  "kind": "repair-negative",
  "disposition": "no-repair",
  "fixture": {
    "failure": "locator-not-found",
    "sideEffectPolicy": "non-replayable",
    "externalEffect": "payment-submit"
  },
  "expect": {
    "diagnosticIds": ["DFSH009"],
    "candidateKinds": [],
    "repairEligible": false,
    "ineligibilityCodes": ["side-effect-policy-repair-prohibited"]
  }
}
