{
  "schema": 1,
  "id": "no-repair-virtualized-reorder",
  "kind": "no-repair",
  "disposition": "no-repair",
  "fixture": { "collection": "orders", "virtualized": true, "selector": { "typeIndex": { "type": "Button", "index": 1 } }, "reordered": true },
  "expect": { "diagnosticIds": ["DFSH003", "DFSH005"], "candidateKinds": [] }
}
