{
  "schema": 1,
  "id": "xaml-advisory-template-automation-id",
  "kind": "no-repair",
  "disposition": "no-repair",
  "fixture": {
    "xaml": "<ContentPage><CollectionView><CollectionView.ItemTemplate><DataTemplate><Button AutomationId=\"SaveButton\" /></DataTemplate></CollectionView.ItemTemplate></CollectionView></ContentPage>",
    "scope": "template"
  },
  "expect": {
    "diagnosticIds": ["DFXAML003"],
    "repairEligible": false,
    "ineligibilityCodes": ["template-or-style", "repeater-or-virtualized"]
  }
}
