{
  "schema": 1,
  "id": "csharp-no-proposal-template-factory",
  "kind": "no-repair",
  "disposition": "no-repair",
  "fixture": {
    "language": "CSharp",
    "source": "new DataTemplate(() => new Button { Text = \"Save\" });",
    "scope": "template-lambda-factory"
  },
  "expect": {
    "diagnosticIds": ["DFCS003"],
    "repairEligible": false,
    "ineligibilityCodes": ["template-or-repeater", "collection-lambda-or-factory"]
  }
}
