{
  "schema": 1,
  "id": "product-regression-no-repair",
  "kind": "product-regression",
  "disposition": "no-repair",
  "fixture": { "action": "tap", "selector": { "automationId": "submit" }, "assertion": { "kind": "routeIs", "expected": "/receipt", "actual": "/error" } },
  "expect": { "diagnosticIds": ["DFSH009"], "candidateKinds": [] }
}
