{
  "schema": 1,
  "id": "repair-validation-verification-rollback",
  "kind": "repair-negative",
  "disposition": "no-repair",
  "fixture": {
    "validation": "independent-oracle-failed",
    "verification": "one-of-three-failed",
    "rollback": "write-failed"
  },
  "expect": {
    "diagnosticIds": ["DFSH009"],
    "candidateKinds": [],
    "repairEligible": false,
    "ineligibilityCodes": ["validation-failed", "verification-failed", "rollback-failed"]
  }
}
