{
  "schema": 1,
  "id": "mutation-hierarchy-type-change",
  "kind": "mutation",
  "disposition": "diagnostic-only",
  "fixture": { "recorded": { "type": "Button", "ancestor": "toolbar" }, "live": { "type": "ImageButton", "ancestor": "toolbar" } },
  "expect": { "diagnosticIds": ["DFSH003"], "candidateKinds": ["role-type-ancestor"] }
}
