{
  "schema": 1,
  "id": "repair-no-ambiguity-close-score",
  "kind": "repair-negative",
  "disposition": "no-repair",
  "fixture": {
    "failure": "locator-not-found",
    "candidates": [
      { "kind": "automation-id", "score": 0.91, "matchCount": 1 },
      { "kind": "automation-id", "score": 0.9, "matchCount": 1 }
    ]
  },
  "expect": {
    "diagnosticIds": ["DFSH001"],
    "candidateKinds": ["automation-id"],
    "repairEligible": false,
    "ineligibilityCodes": ["candidate-scores-too-close"]
  }
}
