{
  "schema": 1,
  "id": "mutation-renamed-automation-id",
  "kind": "mutation",
  "disposition": "diagnostic-only",
  "fixture": { "recordedAutomationId": "save-order", "liveAutomationId": "confirm-order", "route": "/checkout" },
  "expect": { "diagnosticIds": ["DFSH006"], "candidateKinds": ["automation-id"] }
}
